{
  "id": "kanto_living_encounters",
  "title": "Kanto Living Encounters",
  "author": "Dudux42",
  "summary": "Shows encounter-table Pokémon as living overworld entities that can initiate standard battles on contact.",
  "version": "0.1.2",
  "categories": ["CONTENT", "GAMEPLAY"],
  "tags": ["overworld", "encounters", "kanto"],
  "repo": "https://github.com/Dudux42/recompModlist",
  "downloadURL": "https://raw.githubusercontent.com/Dudux42/recompModlist/main/Releases/Stable/kanto_living_encounters_v0.1.2.zip",
  "released": false,
  "api": 2,
  "game_version": ">=0.2.11 <0.3.0",
  "games": ["gen1"],
  "profile": "content",
  "affects_link": false,
  "permissions": ["engine_internals"],
  "dependencies": ["hgss_simple_follower@>=0.1.0-alpha.18 <0.2.0", "gen1_shiny_system@>=0.1.0-alpha.3 <2.0.0"],
  "conflicts": ["overworld_wild_spawns"]
}
