{
  "id": "gen1_character_sprite_replacer",
  "title": "Gen1 Character Sprite Replacer",
  "author": "Dudux42",
  "summary": "Replaces Gen 1 player and NPC presentation with selectable FireRed/LeafGreen-style character art.",
  "version": "0.1.0-alpha.10",
  "categories": ["ART"],
  "tags": ["characters", "overworld", "frlg"],
  "repo": "https://github.com/Dudux42/recompModlist",
  "downloadURL": "https://raw.githubusercontent.com/Dudux42/recompModlist/main/Releases/Stable/gen1_character_sprite_replacer_v0.1.0-alpha.10.zip",
  "released": false,
  "api": 2,
  "game_version": ">=0.1.71 <2.0.0",
  "games": ["gen1"],
  "profile": "content",
  "affects_link": false,
  "experimental": true,
  "permissions": ["engine_internals"]
}
